{"canonicalChecksum":"e4355b88191b6c668eb85ebdfad75cd2dde2b601bd299f1a353649554e4a2f86","containmentContractVersion":"release-2-placement-containment-v1","createdAt":"2026-07-18T12:00:00Z","envelopeBinding":{"bindingContractVersion":"release-2-placement-containment-envelope-binding-v1","bindingVersion":1,"sourceEnvelopePlanChecksum":"7adef8db589165959e3a0c9b801ab3c37c2e6ec7273ea2f08f53c468aec03ed2","sourceMutationEnvelopeChecksum":"d8d2c8b32c31d000c0fd597b05a4aca7a4e43ce9028e8c2196db23ee5e60e984"},"evidenceVersion":1,"findings":[{"detail":"no fluid-connected escape to exterior air within effect envelope","evidenceHash":"1f90d8a30f00432c86f87d643eac1f4adfbc14512bb69ff48f04da068dbe3198","findingId":"boundary-seal-pass","physicsClass":"FLUID","rule":"BOUNDARY_SEAL"},{"detail":"classified 1296 blocks with catalog release-2-placement-block-physics-catalog-v1","evidenceHash":"ff6182263e51f68392e34dba5f34a76b825421310ca3edcc430c6d6ac5ccd28a","findingId":"classification-pass","physicsClass":"SOLID","rule":"CLASSIFICATION"},{"detail":"sealed 1 fluid component(s) inside effect envelope","evidenceHash":"38301a88b25c8ce361ea4821c7aaae41b1d038dff4642052de21c3661ddd5b23","findingId":"fluid-closure-pass","physicsClass":"FLUID","rule":"FLUID_CLOSURE"},{"detail":"no gravity cells in mutation envelopes","evidenceHash":"a52380b37df94634a5c91f0771b7d489de426bd25a0bc0dd5bb5c41710d3ef14","findingId":"gravity-support-vacuous","physicsClass":"GRAVITY","rule":"GRAVITY_SUPPORT"},{"detail":"no neighbor-sensitive cells in mutation envelopes","evidenceHash":"f5392c9c5c0a984fa1677a0b4816ec36a80f1824157912fd31db19d323c62359","findingId":"neighbor-radius-vacuous","physicsClass":"NEIGHBOR","rule":"NEIGHBOR_RADIUS"},{"detail":"observed physics classes are covered by envelope declarations","evidenceHash":"3026cd0376ddcd4aabcb699cb012ac11e7bf3d4e90846037c3b5b8afa3a9c624","findingId":"physics-declaration-pass","physicsClass":"SOLID","rule":"PHYSICS_CLASS_DECLARATION"}],"operationId":"bbbbbbbb-bbbb-bbbb-bbbb-bbbbbbbbbbbb","placementId":"aaaaaaaa-aaaa-aaaa-aaaa-aaaaaaaaaaaa","placementPlanBinding":{"bindingContractVersion":"release-2-placement-containment-plan-binding-v1","bindingVersion":1,"sourcePlacementPlanChecksum":"0ab8615330289dccab0eb7d37c7323b3e9f06214802f0cb243810f11bb9ac22b"},"policy":{"budget":{"budgetVersion":"release-2-placement-containment-budget-v1","maximumBfsNodes":50000000,"maximumCacheEntries":4096,"maximumCanonicalBytes":262144,"maximumScannedBlocks":50000000},"catalogVersion":"release-2-placement-block-physics-catalog-v1","fluidSupportRadiusXZ":2,"fluidSupportRadiusY":2,"gravityFallBlocks":64,"neighborUpdateRadius":1,"policyVersion":"release-2-placement-containment-policy-v1"},"scanStats":{"bfsNodes":108,"cacheEntries":2,"cacheHits":1942,"fluidComponents":1,"gravityBlocks":0,"neighborBlocks":0,"scannedBlocks":1296},"snapshotBinding":{"bindingContractVersion":"release-2-placement-containment-snapshot-binding-v1","bindingVersion":1,"sourceSnapshotPlanChecksum":"2f4e7fb78ef6506a0fef007c54279b3fa6f21dfd15009e0a63119c0399b2afb1"},"unionEffectEnvelope":{"maxX":13,"maxY":74,"maxZ":13,"minX":2,"minY":66,"minZ":2},"verdict":"CONTAINED","worldId":"cccccccc-cccc-cccc-cccc-cccccccccccc"}